{
  "t": 2533000, "possession": "home",
  "ball": { "x": 0.86, "y": 0.40, "z_m": 0.1 },
  "players": [
    { "id": "p_home_9", "x": 0.86, "y": 0.41 },
    { "id": "p_home_8", "x": 0.80, "y": 0.33 },
    { "id": "p_away_1", "x": 0.98, "y": 0.47 },
    { "id": "p_away_4", "x": 0.90, "y": 0.44 }
  ]
}
