{
  "t": 2533000, "fixture_id": "fx_2", "possession": "home",
  "ball": { "x": 0.86, "y": 0.40, "z_m": 0.1 },
  "players": [
    { "id": "p_kes_9", "x": 0.86, "y": 0.41 },
    { "id": "p_kes_8", "x": 0.80, "y": 0.33 },
    { "id": "p_rav_1", "x": 0.98, "y": 0.47 },
    { "id": "p_rav_4", "x": 0.90, "y": 0.44 }
  ]
}
